{
  "$schema": "https://json-schema.org/draft/2020-12/schema",
  "$id": "https://babel.governance/schemas/portable-workflow-v1.schema.json",
  "title": "PortableExportV1",
  "description": "Canonical portable export envelope for Babel workflow runs (portable-workflow-v1).",
  "type": "object",
  "required": [
    "version",
    "run",
    "redaction_profile",
    "exported_at"
  ],
  "additionalProperties": false,
  "properties": {
    "version": {
      "type": "string",
      "const": "portable-workflow-v1"
    },
    "run": {
      "$ref": "#/$defs/WorkflowRunV1"
    },
    "redaction_profile": {
      "type": "string",
      "enum": [
        "public",
        "internal",
        "diagnostic"
      ]
    },
    "exported_at": {
      "type": "string",
      "format": "date-time"
    }
  },
  "$defs": {
    "RevisionRefV1": {
      "type": "object",
      "required": [
        "kind",
        "composite_tree_hash",
        "source"
      ],
      "additionalProperties": false,
      "properties": {
        "kind": {
          "type": "string",
          "const": "workspace-revision"
        },
        "composite_tree_hash": {
          "type": "string",
          "pattern": "^[0-9a-f]{32,64}$"
        },
        "source": {
          "type": "string",
          "enum": [
            "git",
            "filesystem",
            "native-authority"
          ]
        }
      }
    },
    "EvidenceRefV1": {
      "type": "object",
      "required": [
        "id",
        "kind",
        "sha256"
      ],
      "additionalProperties": false,
      "properties": {
        "id": {
          "type": "string",
          "minLength": 1,
          "maxLength": 256
        },
        "kind": {
          "type": "string",
          "enum": [
            "event",
            "artifact",
            "verifier-receipt",
            "checkpoint"
          ]
        },
        "sha256": {
          "type": "string",
          "pattern": "^[0-9a-f]{32,64}$"
        },
        "native_path": {
          "type": "string",
          "minLength": 1
        }
      }
    },
    "AuthorityRefV1": {
      "type": "object",
      "required": [
        "native_kind",
        "native_id",
        "sha256"
      ],
      "additionalProperties": false,
      "properties": {
        "native_kind": {
          "type": "string",
          "enum": [
            "task-contract",
            "instruction-manifest",
            "live-session",
            "episode"
          ]
        },
        "native_id": {
          "type": "string",
          "minLength": 1,
          "maxLength": 256
        },
        "sha256": {
          "type": "string",
          "pattern": "^[0-9a-f]{32,64}$"
        }
      }
    },
    "VerifierIdentityV1": {
      "type": "object",
      "required": [
        "command",
        "command_sha256",
        "scope",
        "independent",
        "clean_room"
      ],
      "additionalProperties": false,
      "properties": {
        "command": {
          "type": "string",
          "minLength": 1
        },
        "command_sha256": {
          "type": "string",
          "pattern": "^[0-9a-f]{32,64}$"
        },
        "scope": {
          "type": "array",
          "items": {
            "type": "string",
            "minLength": 1
          }
        },
        "independent": {
          "type": "boolean"
        },
        "clean_room": {
          "type": "boolean"
        }
      }
    },
    "VerifierReceiptV1": {
      "type": "object",
      "required": [
        "id",
        "status",
        "verifier",
        "bound_revision",
        "authority",
        "evidence",
        "produced_at"
      ],
      "additionalProperties": false,
      "properties": {
        "id": {
          "type": "string",
          "minLength": 1,
          "maxLength": 256
        },
        "status": {
          "type": "string",
          "enum": [
            "passed",
            "failed",
            "blocked"
          ]
        },
        "verifier": {
          "$ref": "#/$defs/VerifierIdentityV1"
        },
        "bound_revision": {
          "$ref": "#/$defs/RevisionRefV1"
        },
        "authority": {
          "$ref": "#/$defs/AuthorityRefV1"
        },
        "evidence": {
          "type": "array",
          "items": {
            "$ref": "#/$defs/EvidenceRefV1"
          }
        },
        "exit_code": {
          "type": "integer"
        },
        "produced_at": {
          "type": "string",
          "format": "date-time"
        }
      }
    },
    "TaskRefV1": {
      "type": "object",
      "required": [
        "task_id",
        "goal",
        "acceptance_criteria",
        "mutation_policy",
        "required_verifiers"
      ],
      "additionalProperties": false,
      "properties": {
        "task_id": {
          "type": "string",
          "minLength": 1,
          "maxLength": 256
        },
        "goal": {
          "type": "string"
        },
        "acceptance_criteria": {
          "type": "array",
          "items": {
            "type": "string"
          }
        },
        "mutation_policy": {
          "type": "string",
          "enum": [
            "read_only",
            "workspace_write",
            "governed"
          ]
        },
        "required_verifiers": {
          "type": "array",
          "items": {
            "type": "string"
          }
        }
      }
    },
    "StageInputV1": {
      "type": "object",
      "required": [
        "kind",
        "task"
      ],
      "properties": {
        "kind": {
          "type": "string",
          "enum": [
            "orient",
            "review",
            "attack",
            "integrate"
          ]
        },
        "task": {
          "$ref": "#/$defs/TaskRefV1"
        },
        "target_refs": {
          "type": "array",
          "items": {
            "$ref": "#/$defs/EvidenceRefV1"
          }
        },
        "stage_refs": {
          "type": "array",
          "items": {
            "type": "string",
            "minLength": 1,
            "maxLength": 256
          }
        }
      }
    },
    "StageResultV1": {
      "type": "object",
      "required": [
        "kind"
      ],
      "properties": {
        "kind": {
          "type": "string",
          "enum": [
            "orient",
            "review",
            "attack",
            "integrate"
          ]
        },
        "findings": {
          "type": "array",
          "items": {
            "type": "string"
          }
        },
        "required_changes": {
          "type": "array",
          "items": {
            "type": "string"
          }
        },
        "reproductions": {
          "type": "array",
          "items": {
            "$ref": "#/$defs/EvidenceRefV1"
          }
        },
        "verifier_receipts": {
          "type": "array",
          "items": {
            "$ref": "#/$defs/VerifierReceiptV1"
          }
        },
        "changed_refs": {
          "type": "array",
          "items": {
            "$ref": "#/$defs/EvidenceRefV1"
          }
        }
      }
    },
    "StageRecordV1": {
      "type": "object",
      "required": [
        "stage_id",
        "kind",
        "status",
        "input",
        "workers",
        "evidence"
      ],
      "additionalProperties": false,
      "properties": {
        "stage_id": {
          "type": "string",
          "minLength": 1,
          "maxLength": 256
        },
        "kind": {
          "type": "string",
          "enum": [
            "orient",
            "review",
            "attack",
            "integrate"
          ]
        },
        "status": {
          "type": "string",
          "enum": [
            "pending",
            "running",
            "passed",
            "failed",
            "blocked",
            "cancelled"
          ]
        },
        "input": {
          "$ref": "#/$defs/StageInputV1"
        },
        "result": {
          "$ref": "#/$defs/StageResultV1"
        },
        "workers": {
          "type": "array",
          "items": {
            "type": "string",
            "minLength": 1,
            "maxLength": 256
          }
        },
        "evidence": {
          "type": "array",
          "items": {
            "$ref": "#/$defs/EvidenceRefV1"
          }
        }
      }
    },
    "WorkerRunV1": {
      "type": "object",
      "required": [
        "worker_id",
        "stage_id",
        "role",
        "status",
        "native_authority",
        "evidence"
      ],
      "additionalProperties": false,
      "properties": {
        "worker_id": {
          "type": "string",
          "minLength": 1,
          "maxLength": 256
        },
        "stage_id": {
          "type": "string",
          "minLength": 1,
          "maxLength": 256
        },
        "role": {
          "type": "string",
          "enum": [
            "primary",
            "reviewer",
            "verifier",
            "integrator"
          ]
        },
        "status": {
          "type": "string",
          "enum": [
            "pending",
            "running",
            "passed",
            "failed",
            "blocked",
            "cancelled"
          ]
        },
        "provider": {
          "type": "string",
          "minLength": 1
        },
        "native_authority": {
          "$ref": "#/$defs/AuthorityRefV1"
        },
        "evidence": {
          "type": "array",
          "items": {
            "$ref": "#/$defs/EvidenceRefV1"
          }
        }
      }
    },
    "TerminalOutcomeV1": {
      "type": "object",
      "required": [
        "kind"
      ],
      "properties": {
        "kind": {
          "type": "string",
          "enum": [
            "completed_verified",
            "completed_unverified",
            "blocked_external",
            "blocked_policy",
            "budget_exhausted",
            "cancelled",
            "infra_failure",
            "agent_failure"
          ]
        },
        "receipts": {
          "type": "array",
          "items": {
            "type": "string",
            "minLength": 1,
            "maxLength": 256
          }
        },
        "revision": {
          "$ref": "#/$defs/RevisionRefV1"
        },
        "reason": {
          "type": "string",
          "minLength": 1
        },
        "dimension": {
          "type": "string",
          "enum": [
            "turns",
            "tokens",
            "repair",
            "infra"
          ]
        }
      }
    },
    "WorkflowRunV1": {
      "type": "object",
      "required": [
        "version",
        "run_id",
        "task",
        "authority",
        "stages",
        "workers",
        "evidence"
      ],
      "additionalProperties": false,
      "properties": {
        "version": {
          "type": "string",
          "const": "portable-workflow-v1"
        },
        "run_id": {
          "type": "string",
          "minLength": 1,
          "maxLength": 256
        },
        "task": {
          "$ref": "#/$defs/TaskRefV1"
        },
        "authority": {
          "$ref": "#/$defs/AuthorityRefV1"
        },
        "stages": {
          "type": "array",
          "items": {
            "$ref": "#/$defs/StageRecordV1"
          }
        },
        "workers": {
          "type": "array",
          "items": {
            "$ref": "#/$defs/WorkerRunV1"
          }
        },
        "terminal": {
          "$ref": "#/$defs/TerminalOutcomeV1"
        },
        "revision": {
          "$ref": "#/$defs/RevisionRefV1"
        },
        "evidence": {
          "type": "array",
          "items": {
            "$ref": "#/$defs/EvidenceRefV1"
          }
        }
      }
    }
  }
}
